{
  "id": "simple-latin-issue4575",
  "category": "simple-latin",
  "description": "Trivial two-word single-line document from pdf.js's own bug-repro set.",
  "source": { "kind": "corpus", "corpus": "pdfjs-subset-0adc2e7c6652", "relativePath": "issue4575.pdf" },
  "oracle": {
    "method": "poppler pdftotext (independent third-party extractor, never PlumePdf)",
    "generatedAt": "2026-08-18",
    "notes": "pdftotext issue4575.pdf -"
  },
  "pageCount": 1,
  "mediaBoxPoints": { "width": 200, "height": 50 },
  "extractPermission": null,
  "encryptMetadataFalse": false,
  "knownFailure": { "expected": false },
  "pages": [
    {
      "page": 1,
      "expectedText": "Issue 4575",
      "firstWord": "Issue",
      "lastWord": "4575",
      "readingOrder": "not-asserted"
    }
  ]
}
