{
  "id": "simple-latin-issue1293r",
  "category": "simple-latin",
  "description": "Trivial single-line Times-Roman/WinAnsi document.",
  "source": { "kind": "corpus", "corpus": "pdfjs-subset-0adc2e7c6652", "relativePath": "issue1293r.pdf" },
  "oracle": {
    "method": "poppler pdftotext (independent third-party extractor, never PlumePdf)",
    "generatedAt": "2026-08-18",
    "notes": "pdftotext issue1293r.pdf -"
  },
  "pageCount": 1,
  "mediaBoxPoints": { "width": 200, "height": 50 },
  "extractPermission": null,
  "encryptMetadataFalse": false,
  "knownFailure": { "expected": false },
  "pages": [
    {
      "page": 1,
      "expectedText": "Issue 1293",
      "firstWord": "Issue",
      "lastWord": "1293",
      "readingOrder": "not-asserted"
    }
  ]
}
